{
  "version": 2,
  "name": "dsh-model-plus",
  "updatedAt": "2026-03-22T12:00:00Z",
  "description": "Upstream defaults matched by model id/name patterns only (not by provider).",
  "models": [
    {
      "idPattern": "^auto$",
      "reasoningEfforts": false,
      "vision": false
    },
    {
      "idPattern": "deepseek|reasoner|(^|[^a-z])r1([^a-z]|$)",
      "thinkingFormat": "deepseek",
      "reasoningEfforts": {
        "off": null,
        "low": "low",
        "medium": "medium",
        "high": "high"
      },
      "vision": false
    },
    {
      "idPattern": "grok",
      "thinkingFormat": "openai",
      "reasoningEfforts": {
        "low": "low",
        "high": "high"
      },
      "vision": true
    },
    {
      "idPattern": "gpt-5|chatgpt|(^|[^a-z])o[1-4]([^a-z]|$)",
      "thinkingFormat": "openai",
      "reasoningEfforts": {
        "minimal": "minimal",
        "low": "low",
        "medium": "medium",
        "high": "high",
        "xhigh": "xhigh"
      },
      "vision": true
    },
    {
      "idPattern": "glm|chatglm",
      "thinkingFormat": "openai",
      "reasoningEfforts": {
        "off": null,
        "low": "low",
        "high": "high"
      },
      "vision": true
    },
    {
      "idPattern": "qwen|qwq",
      "thinkingFormat": "qwen",
      "reasoningEfforts": {
        "off": null,
        "low": "low",
        "high": "high"
      },
      "vision": true
    },
    {
      "idPattern": "claude",
      "thinkingFormat": "openai",
      "reasoningEfforts": {
        "low": "low",
        "medium": "medium",
        "high": "high"
      },
      "vision": true
    },
    {
      "idPattern": "think|reason",
      "thinkingFormat": "openai",
      "reasoningEfforts": {
        "low": "low",
        "medium": "medium",
        "high": "high"
      }
    }
  ]
}
